review,span,Aspect
I dont know if there are legal restrictions on signal power but it seemes that current technology should allow further range for a signal expander, restrictions on signal power ,signal
"The wireless connection worked okay, but I could never get more than 35% signal (40 feet, 2 walls between)", could never get more than 35% signal ,signal
"The desktop works fine as it's not wireless, but I have been having issues with my signal dropping on the laptops, and another issue with weak signal strength", having issues with my signal ,signal
I have been having issues with signal drops in my laptop, issues with signal drops ,signal
I have been having issues with signal dropping on the laptops, having issues with signal dropping ,signal
"It appears that my connection is no longer dropping, but I still have a weak signal when I'm right next to the router", have a weak signal ,signal
Router worked adequately during the first 5 months - I was disappointed that the wireless signal was no better than an old Belkin G router - that was the primary reason for my upgrade, disappointed that the wireless signal ,signal
The wireless signal was no better , signal was no better ,signal
The first unit I bought could not acquire a satellite signal , could not acquire a satellite signal ,signal
It's true that the router drops the wireless signal constantly, drops the wireless signal ,signal
I get low strength signal when I connect to this router through a wireless network card in my laptop, get low strength signal ,signal
This unit also looses Satellite signal much more often than our older Garmin, looses Satellite signal ,signal
"The WNDR3700 router constantly drops signal , cannot even give proper wifi speeds to anything (i", constantly drops signal ,signal
"From what most other customers who've bought the item say on forums it's because of interference from other signal and such so I've also tried to switch channels and double check settings, but no help", interference from other signal ,signal
Every 3-4 days the device will lock up and I will loose all wireless signal , loose all wireless signal ,signal
 Signal strength is so lousy that I have a better, Signal strength is so lousy ,signal
Then we started losing wireless signal . , started losing wireless signal ,signal
"Ocassionally, then we had no signal ", had no signal ,signal
You can literally sit a laptop right next to this unit and the signal is unavailable , signal is unavailable ,signal
Was unable to get enough signal strength to go 200 ft, unable to get enough signal ,signal
"This is only one wall, maybe fireplace and floor, unless ceramic tile interferes with signal ", interferes with signal ,signal
We have a very small house and it puts out a low signal , puts out a low signal ,signal
"Bought Router, worked great for several months, then I started having devices drop off the WiFi signal ", drop off the WiFi signal ,signal
"Reset router and all is good for a few weeks, then devices start dropping the WiFi signal again", dropping the WiFi signal ,signal
"you are using the router in yor house or apartment, you will lose significant signal strength", lose significant signal ,signal
I didn't find this out until I complained to customer service about the weak signal at only 30 feet from the router, weak signal ,signal
Compared with cellular navigation systems it's more accurate and you don't have to worry about loss of signal unless you enter a tunnel, loss of signal ,signal
"In fact, it makes signal clarity worse ", signal clarity worse ,signal
"However, I am one of the people who have had issues with it, namely the wireless signal dropping out several times a day", signal dropping out ,signal
"About 4 times a day, the router will drop the wireless signal ", drop the wireless signal ,signal
"First month or so worked great, then I started to get dropped signal every few days or so and have had to unplug/replug the power cord just to get a signal again", get dropped signal ,signal
"now I lose the signal daily and have to power cycle it at least once a day, sometimes 3 or more! [lose, have] [daily, least, more] ", lose the signal daily ,signal
If they don't see the extender they try to connect to the primary router which is usually too far away and low (if any) signal strength (that's why you are looking at buying this thing in the first place), low (if any) signal strength ,signal
The range is just awesome without weak signal but in this model I have reserved complaint for the fact that my wireless printer was being blocked, weak signal ,signal
Out of the blue it will just stop sending a signal out, stop sending a signal ,signal
Everything you have connected to it wireless has no signal , wireless has no signal ,signal
They are hard to set up (you have to use lengthy codes) and the signal is intermittent , signal is intermittent ,signal
"Even after fine-tuning it, the wireless signal was faint at best", signal was faint ,signal
The next unit I received works fine for about an hour or two and then it randomly looses the satellite signal and becomes totally useless, looses the satellite signal ,signal
"Our primary reason for wanting to get this router was its alleged high speed and performance, neither of which has proven to be valid: the 5-GHz antenna has very low signal strength as compared with the 2", has very low signal ,signal
The signal drops off quickly from there, signal drops off quickly ,signal
"Walls also quickly kill the connection, causing the signal to drop in half when entering a different room", signal to drop in half ,signal
"This new router was slower by far, dropped connections, had much less range, weak signal , and customer/technical support (I think from Somalia) was a travesty", weak signal ,signal
"It turned out that he hooked it up correctly, and it worked fine as a wired router, but the unit did not transmit a signal ", did not transmit a signal ,signal
If you have a 54 mbps router/access point this device bounces that signal but only at 22 mbps, bounces that signal ,signal
"But, it would drop its wireless signal every few days and need to be completely reconfigured", drop its wireless signal ,signal
It has never dropped its wireless signal , dropped its wireless signal ,signal
"This one was set up in a "" tough environment"" Expanding a wireless network in a bldg with concrete floors through which wireless signal do not penetrate ", signal do not penetrate ,signal
It didn't work - the signal was so weak . , signal was so weak ,signal
The signal dropped every few seconds it was totally unusable, signal dropped every few seconds ,signal
"Whenever certain encryption modes are enabled, all of the attached wireless devices drop signal momentarily every 4-5 minutes", drop signal momentarily ,signal
"I would be concerned with the security, but the signal strength is so poor that I doubt it's an issue", signal strength is so poor ,signal
The signal drops off with my own house, signal drops off ,signal
The response to the cabled connection not working , connection not working ,connection
"When I upgraded the firmware to the latest version, the router started dropping wireless connection , rebooting randomly, etc", dropping wireless connection ,connection
"Linksys was more complex to set-up and seem to be prone to dropping connection ; therefore, everyday performance was consistently unreliable", dropping connection ,connection
"It will drop connection from computers and will refuse new connection , even while others are still connected", refuse new connection ,connection
"On the good side, our wireless connection have gone from weak and good on our old router to very good and excellent now on this router", connection have gone from weak ,connection
It is already broke and the connection is slow , connection is slow ,connection
"Plus: easy setup, great parental controls, fairly good wireless coverage Minus: both the wired and wireless connection dropped intermittenly ", connection dropped intermittenly ,connection
"I can be in the middle of surfing, playing games over the net or even mid-download, the DHCP server will attempt to renew and drop the internet connection ", drop the internet connection ,connection
It would randomly drop its connection back to the wireless router it was connecting with, drop its connection ,connection
"Sure the signal was stronger after i installed the Range Expander, but it was less reliable do to all the dropped connection ", dropped connection ,connection
"3) I upgraded to the latest firmware as of Nov 2008, still tons of issues, it works after I reboot cleanly for 5 mins or so, then wireless connection keep falling very frequently especially if I'm using more than 1 wireless or wired connection, also my PS3 and Vonage were not performing as well as before", connection keep falling ,connection
Switched everything to G and still it drops the connection with any mid / heavy wireless usage pattern, drops the connection ,connection
"I ordered this router to replace a 2yo rangemax that had suddenly started randomly losing connection , which i've since learned is a commonly noted problem with rangemax", losing connection ,connection
"At this point, you can plug things in, and the connection is up and down every few minutes", connection is up and down ,connection
The largest problem/issue I have is that it will randomly just drop the connection , drop the connection ,connection
"I can't notice any difference - except it used to drop my connection several times an hour! [notice, used, drop] [several] ", drop my connection ,connection
There were a few times it would either drop my laptop or my desktop if I was using both and had to reboot the router to regain connection , regain connection ,connection
"This thing locks up constantly and brings my internet connection down every time, something Linksys is obviously aware of because they address it in the users manual -- Push the reset button and things'll clear right up", connection down ,connection
"A couple days after that, all the WiFi-connected PCs lost Internet connection (although they still had LAN connectivity), yet the Ethernet-connected PCs did not lose the Internet", lost Internet connection ,connection
The router drops connection regularly on the new Dell and does not connect at all with the other 2 machines, drops connection ,connection
I ran through the install routine provided and got no Internet connection , no Internet connection ,connection
And it constantly drops wireless connection (with optimal placement and configuration where other wifi routers shine), drops wireless connection ,connection
"I digged a little deeper and found the computer that's hard wired to the router is always fine, but the other computers, iPhone, Droid, would drop the connection frequently", drop the connection ,connection
"Tonight, I got home and the wireless connection would not work right", connection would not work ,connection
"Then, it always droped connection even if the router was placed next to my computer", droped connection ,connection
To improve the speed I bought Dlink DIR-655 router about a month ago and since then I am having very frequent connection droping problems, connection droping ,connection
At first I got dropped connection every 30 seconds and flashing lights, dropped connection ,connection
"The excitement quickly vanished when I walked 10 feet away from the access point and the signal dropped to 50%(clear line of sight) about 25 feet away, through 2 walls, the signal and connection quality was poor or non-existent if I moved my hand or arm in front of the card", connection quality was poor ,connection
"What really bugged me was how often I lost my connection , wireless and plugged in with a network cable", lost my connection ,connection
On downloads I would start out great but they never finished as the connection slowly worksed itself down until it dropped, connection slowly worksed ,connection
"I got a level 2 tech and they went over the same things the first tech did, and this time started to demand what my public IP was, when I told him my linksys works be it slow and this thing goes up and down he kept saying it could be an issue with my connection ", issue with my connection ,connection
"In addition to the wireless problems, the router would also drop my wired connection every so often just for the heck of it", drop my wired connection ,connection
"The USB storage connection was the big problem : the router's services were hanging up every 15 minutes or so, requiring a power cycle", connection was the big problem ,connection
The internet connection speed gets slower and slower with videos causing youtube and netflix to not work properly, connection speed gets slower ,connection
If I wanted spotty wifi connection I would have just stolen my neighbors wifi, spotty wifi connection ,connection
signal was strong but there was no Internet connection , no Internet connection ,connection
"While configuring it is very nice and easy, the router needs to be rebooted after every few hours of use or it will drop its wireless connection ", drop its wireless connection ,connection
"Every hour or two I experience WiFi connectivity loss for ~3 seconds, causing my VPN connection to terminate , and it gets me mad because I have to waste about 10-15 minutes to recover every time", connection to terminate ,connection
Router drops connection 1-3 time a day, drops connection ,connection
Expensive equipment and wi-fi connection drops frequently, connection drops ,connection
"Also, the USB connection was very slow (when it worked) and several times I was losing the mapped usb drive", connection was very slow ,connection
"Sometimes it would work fine, then my PC would drop the connection and I had a hard time getting connected again", drop the connection ,connection
Now it has lots of issues - every few minutes it drops all connection , drops all connection ,connection
The new one is a 1490T and works for navigation but the bluetooth connection is difficult to set up and drops out between connection, connection is difficult to set up ,connection
"It loses connection at least 8 or 9 times a day, and the only way to recover is to physically disconnect the power supply and reconnecting it a few seconds later to reboot the router", loses connection ,connection
"2) "" Lost connection "" during the long holding times", Lost connection ,connection
"after a year of usage, the wireless connection drop about once every 2 weeks", connection drop ,connection
4GHz cordless phone kills the connection every time, kills the connection ,connection
The download windows often hang and ftp connection are very unstable , connection are very unstable ,connection
"After less than one day, one of the machines lost it's connection ", lost it's connection ,connection
The second one diudn't even get their procedures right (I had just been through them 3 times) as he skipped necessary steps (Like telling me to open properties of the network connection icon in control panel rather thn opening it and going to the connection at issue , connection at issue ,connection
"It will, in a time of between several minutes to 24 hours, cause the wga54g to lock up and lose it's internet connection , with the wireless light staying lit solidly", lose it's internet connection ,connection
"But the wireless connection dies intermittently, sometimes as often as several times a day! [dies] [wireless, several] ", connection dies ,connection
Sometimes I lose my connection for 5-10 minutes and it will return without intervention, lose my connection ,connection
"Other times, the connection goes down hard - and the only way to fix it is to power down the router completely, wait a few seconds, and plug it back in", connection goes down ,connection
"I used it for about 3 months, for sharing a broadband internet connection at home, with very frequent resets, connection losts , I sometimes had to turn it off and on to get my laptop's wirelessly connected because it sometimes refuse to give me an ip address", connection losts ,connection
The next morning when I booted the network; no network and no DSL connection , no DSL connection ,connection
"Oddly too, the VPN connection appeared ""dead"" ; ie, I had no internet connectivity for my web browsers, etc, when the VPN was connected"," connection appeared ""dead"" ",connection
"I was very happy with the product initially, but then came home from vacation to find the connection had dropped ", connection had dropped ,connection
"This router was a gift; I have set it up with the factory firmware and no one complained about the WiFi a signal dropping, or slow connection speed", slow connection ,connection
The connection is not reliable and constantly dropped, connection is not reliable ,connection
I used to lose my connection every few days, lose my connection ,connection
"Frequently, on both a wired and wireless connection, the connection would drop or slow to unbearable speeds", connection would drop ,connection
11b router due to this device's dropped connection and frequent losses in speed (Although I would recommend getting another brand of 802, dropped connection ,connection
"On other occasions I will be surfing the Web just fine, then all of a sudden the connection stops working ", connection stops working ,connection
"When the connection randomly drops , it's not like it's my ISP's fault because the hard-wired connection still works fine", connection randomly drops ,connection
Typically the connection goes out at least once a day, connection goes out ,connection
"The Netgear router installs very easily as do most routers now days and the hard wire ports work fine, but the wireless connection would drop every 10 to 15 seconds at only 20 ft away", connection would drop ,connection
My internal wired connection dropped while the wireless was still working so I know it wasn't my cable mode, connection dropped ,connection
 Looses connection to the router several times a day requiring rebooting the Netgear router, Looses connection ,connection
"I had been using a Dell wireless router for nearly six months, but when we began having some connection speed problems , Dell said it NEVER should have worked with Charter Pipeline (my cable provider)", connection speed problems ,connection
"Under intensive usage, it never losts connection , never resets", losts connection ,connection
This device was easy to set up however consistently after 30 minutes it will drop all connection , drop all connection ,connection
"Although the connection was flaky , the range and speed were reasonbly decent", connection was flaky ,connection
"A housemate originally installed his WRT 54G and we routinely had dropped internet connection , usually at least once a day", dropped internet connection ,connection
"For some reason, I can't get more than ten feet away without the unit without getting a warning that my network connection's been lost ", connection's been lost ,connection
wep slows down my connection big time, slows down my connection ,connection
"It consistently dropped my broadband connection , giving me a new IP address every 2 minutes, and did not have ""Port Triggering"" or ""UPnP"" options available in the setup menus", dropped my broadband connection ,connection
"However, I run two wireless laptops and both have frequent issues with disconnection ", issues with disconnection ,connection
It drops my connection on a daily basis and even minor changes to the wireless settings must be done after reverting to factory default, drops my connection ,connection
"Two debilitating problems with this router:1) I have a Sony Vaio Centrino notebook, and cannot get a reliable connection with it", cannot get a reliable connection ,connection
This makes the wireless connection basically unusable , connection basically unusable ,connection
"Conclusion: Given modern manufacturing techniques, its hard to believe there's things like loose wires or bad connection ", bad connection ,connection
"Removing it from the network resolved the issues of daily dropped connection , and it turned out the DLink-655 had enough range I didn't need the extender", dropped connection ,connection
It lost connection every several days and I had to unplug the power and restart it, lost connection ,connection
The wireless connection was inconsistent and unreliable and one of my computers couldn't connect to it at all, connection was inconsistent ,connection
"We got another computer and i got the USB one, and it DID work good but bad connection ", bad connection ,connection
We have had this wireless router for over a year when suddenly it started dropping the connection , dropping the connection ,connection
"However, I noticed a distinct pattern as to when the router was dropping the connection ", dropping the connection ,connection
While the router still drops connection occasionally it is not as bad as it use to be, drops connection ,connection
"Wireless connection slow quickly as distance from the unit increases, but it does work", connection slow quickly ,connection
"One simple problem, the email instructions said that I needed to change my IP address on the router because my dsl provider (shentel) was using the same IP address and that is why i could not get a connection ! [said, needed, change, was, using, is, get] [simple, same] ", could not get a connection ,connection
As others noted below this router drops local connection constantly (2 to 3 times daily) I did not have this problem until I updated the firmware to the latest release: 1, drops local connection ,connection
The main problem with this router and most wireless devices is a dropped connection , dropped connection ,connection
Many dropped connection for wireless, dropped connection ,connection
Wireless connection is not smooth at all, connection is not smooth ,connection
"Whether you're directly connected to it via Ethernet or using the wireless connectivity, the connection goes dead every half hour", connection goes dead ,connection
"It's like clockwork, and the only way to get the connection back is to unplug it for 15-20 seconds and plug it in again, only to have to go through the same process a half hour later when your connection dies again", connection dies ,connection
"Linksys appears to be doing nothing about this problem, and the only solution that's been found anywhere is to put a network switch between your computer and the router, but that still doesn't help the connection drop on the wireless which, needless to say, is a serious problem for a wireless router", connection drop ,connection
At the moment I am using it for wired purposes so I cannot comment on its wireless functionality however wen i start my pc b4 i can get conected 2 the internet i have to unplug my router an plug it bak in again and at times it drops connection , drops connection ,connection
"But most importantly, you lose connection after every 30 minutes or so", lose connection ,connection
"I purchased this router over six months ago, and ever since I've had many problems with the connection dropping on several laptops in the house", connection dropping ,connection
 Bad connection w/ charging mechanism within gps to start with, Bad connection ,connection
"After a day and a half of trying, I could connect to the router but it could not detect an internet connection and get online (which to me is one of the more critical functions of a router)", could not detect an internet connection ,connection
I duplicated the settings from my old work horse Linksys WRT54g router (which by the way works fine on my network) but could not establish an internet connection , could not establish an internet connection ,connection
"I'm not exactly IT savvy and though all the problems I was having with it constantly dropping my connection were my fault or my ISP's fault, but now I know it really is the router", dropping my connection  ,connection
"I called support again and they figured out some issue with 'mac cloning' or some such, reset my static IP, and all was well for another week, when the same issue-- losing connection with the router after 10-20 minutes online--arose again", losing connection ,connection
The current WRT54G frequently drops connection or locks up, drops connection ,connection
Finally I was through all this only to discover that this pile of garbage cannot hold wireless connection , cannot hold wireless connection ,connection
All prior notes from other customers on instability of wireless connection are very true (overheating seems to be very likely the cause), instability of wireless connection ,connection
"Whenever I turned on that feature, even if I had all the right MAC entries, the wired connection stopped working ", connection stopped working ,connection
Now it just drops the connection unless you go static in which case you lose about half of your packets, drops the connection ,connection
"I've tried many times at home on the laptop, but I lose the connection before I can finish", lose the connection  ,connection
11g card and it have very bad connection with 802, bad connection ,connection
"Like other reviewers suffered drop connection ever so often, like other reviewers called tech support and was told it can be fix easily if i pay $69", drop connection ,connection
"However, wireless connection is not stable at all", connection is not stable ,connection
"When I came back, sure enough the connection was dead again , so I went through the same steps and eventually got it to come back up", connection was dead again ,connection
