review,span,Aspect
"- ability to custom map functions to the various button Cons: - large and fairly heavy mouse requires a bit more effort and space to move around - only runs off a single AA battery - battery life is not very good (about 2-3 weeks) - SetPoint software only displays battery life as full/good/poor instead of the more accurate ""XX days remaining"" - button placement is awkward ", button placement is awkward ,button
That's too many button too close together, button too close ,button
"Giving this 4-stars, even though I really wanted 5, just because of that top button problem ", button problem ,button
"The wheel is great, I'm continuing to use the mouse, but the rest of the button are mostly useless ", button are mostly useless ,button
"Cons: 1) The biggest single drawback of the MX Revolution - even bigger than its exorbitant price - is that the microswitch under the left mouse button is weak and usually fails in well under one year, depending on how often and how hard you use the mouse", button is weak ,button
"I thought it strange actually, that the button seemed to not fit the rest of this very ergo-looking mouse", button seemed to not fit ,button
"Recently, my new mouse's scroll wheel button stopped working ", button stopped working ,button
The actual action of the button doesn't press from the center but on the far left edge, button doesn't press ,button
My only con for this mouse is that in Maya 3D the middle mouse button is a little finicky in advanced hold and move functions, button is a little finicky ,button
"Background info: before this, I was using the MX600 cordless laser mouse that came as part of the MX3200 wireless package; which I have also been very satisfied with except 1) I hated having to go through batteries so fast (was replacing the batteries on the mouse on average maybe once every 4-6 weeks) and 2) after a bit over a year, the button on the mouse became noticeably less responsive as I had to exert a noticeable amount of force for the clicks to register", button on the mouse became noticeably less responsive ,button
"The unusually high tension on the wheel button can be a bit annoying , and I wonder if it might be bad for carpal tunnel-type problems", button can be a bit annoying ,button
"Much less than the 6 months I was getting with my previous mobile mouse, the original arc mouse (that I finally had to replace when the right click button became wonky )", button became wonky ,button
The left button has also stopped working consistently , button has also stopped working consistently ,button
Middle mouse button is too rigid , button is too rigid ,button
Left button either wouldn't work or it acted like a double click, button either wouldn't work ,button
The wheel button became useless doing the same things as described here, button became useless ,button
I took the hint that a new mouse was in order when the paint wore off the left mouse button and the wheel stopped scrolling to the left, paint wore off the left mouse button ,button
"It's not that it's an eyesore, and even the fact that I feel the height difference with my fingers isn't a problem, but I've noticed that the right button is a bit stiff , possibly for the same reason", button is a bit stiff ,button
"pressing the middle button requires significant pressure , and just isn't comfortable", button requires significant pressure ,button
The forward and backward button are too slim that you have to click them carefully being afraid of breaking them, button are too slim ,button
"i would like to be able to have more configuration options for the zoom button, especially since the middle button is not reliable ", button is not reliable ,button
"If I put the receiver on the back of my desktop PC, or across my desk in my laptop docking station, I get intermittent pauses and unresponsive button clicks ", unresponsive button clicks ,button
"Other users complain their thumb is too short (probably because they have normal length fingers), because the button are pretty far forward", button are pretty far ,button
"This isn't an issue for me, but the button are absolutely too high ", button are absolutely too high ,button
"This revolution mouse has a ton of button, which can be configured to be situationally useful, but so far the extra button haven't been as useful as I thought they would be", button haven't been as useful ,button
"They should have put both side button on the left side of the mouse for right handed users to use with their thumb, because the right side button isn't easy to hit ", button isn't easy to hit ,button
"I haven't used this in a long time, but having it at a desktop now I notice the wheel button is accidentally pressed all the time, there is not much of a ""click"" either", button is accidentally pressed ,button
But its forward and backward button are not friendly designed, button are not friendly ,button
Battery button was stuck when I received but works fine now, button was stuck  ,button
"I didn't notice this mentioned in other reviews until after I bought it, but the middle wheel/ button click is barely functional ", button click is barely functional ,button
"*) (* key selling point *) - Low resistance scroll - Multiple button can be customized to different tasks And the caveat as to why I rated it low and returned (2) mice and bought another: - Mouse #1 - middle button was intermittent - Mouse #2 - middle button worked, but had to be pushed at a certain angle to trigger, which was different given the length of my middle finger, which I would term average", button was intermittent ,button
"Then one day, all the extra button stopped working completely ", button stopped working completely ,button
"actually works on almost any surface and extremely powerful signal, the only problem is its size and the scroll wheel button is too hard , and does not respond well to design programs is almost a torture, for a normal job does not demand intensive use will be perfec", button is too hard ,button
2) Forward/backward thumb button are a bit high , button are a bit high ,button
"3) Right/Left click button are supper sensitive , as I often clicked when I didn't want to", button are supper sensitive ,button
The problem I have with it is that the side button are in the wrong place , button are in the wrong place ,button
"This one, the side button on the left is too high and too far forward and I have to move my whole hand and twist it around, then the whole mouse moves out of position making it unecessarily awkward to use", button on the left is too high ,button
Other than the side button issue this is a great little mouse, button issue ,button
The middle button works randomly , button works randomly ,button
I'm assuming there is a hardware problem with the thumbwheel pushbutton-the function of the wheel pushbutton is not consistent throughout the entire rotation of the wheel, pushbutton is not consistent ,button
"On the defective mouse, the scroll wheel worked, the right button worked intermittently , but the pointer wouldn't move", button worked intermittently ,button
I'm also finding that the left click button is inconsistent , button is inconsistent ,button
The issue with the left button having problems is real and very annoying, button having problems ,button
Then all the extra button are pretty much useless , button are pretty much useless ,button
Document Flip and the Search button are completely worthless , button are completely worthless ,button
"The movement quality went down, and the main click button is almost dead - I have to really bang on it for the click to be noticed", button is almost dead ,button
As the battery drains each button will disappear and finally the LED will turn red letting you know its almost out of juice, button will disappear ,button
"Button location, not the same as the Revolution, looks similiar but you have to really move your fingers to engage the side button which is important when doing production work, not being able to program the button behind the wheel and its sensitive right and left button made it impossible to use with Autocad", button made it impossible to use ,button
"Just today (2/2/12) , when I hit the lockout button, the screen went black and I was unable to revive the machine even by putting it on the usb cable", screen went black ,screen
The screen is in a 'stuck' mode and nothing I do can reset it; it won't even power off, screen is in a 'stuck' mode ,screen
When I got home I noticed even though the screen was black and I couldn't turn it on (even tried the 15 second power-button reset) the Clip+ was quite warm, screen was black ,screen
The display screen was too small to read any song titles, screen was too small ,screen
"the screen was super small and i had bought this for my mom, so she had to strain to see what she was doing", screen was super small ,screen
im not sure if the one we received was defective but the screen started to fade about 2 weeks since we had it, screen started to fade  ,screen
The screen went dead but the little guy still worked, screen went dead  ,screen
The screen was still dead and yet it still played, screen was still dead ,screen
"The power button stopped working on one, another one the computer can't recognize when it gets plugged in, and the other two just froze, the screen froze , and the battery died and can be no longer be charged or turned on", the screen froze ,screen
Navigation is difficult with such a small screen and song tags do not always appear correctly (typical with most devices it seems), small screen ,screen
PROS: - compact - inexpensive - drag and drop of files without extra software - compatible with most audio formats - decent battery life - expandable memory CONS: - small base memory - clunky interface - tiny screen - software crashes - power button stopped working - worthless headphones, tiny screen ,screen
"Still works like a charm - same sound quality as day 1, the screen has a couple of dead pixels (water damage) but no cracks, and the click wheel works great! [works, has, works] [same, sound, dead, great] ", screen has a couple of dead pixels ,screen
"Second, the screen comes with a sticker covering the tiny screen which is crazy glued in place", tiny screen  ,screen
"Tried plugging into a rear USB and within seconds,it showed a complete charge,but nothing else on display screen ", nothing else on display screen ,screen
I pushed the next song button and the screen went black , screen went black ,screen
"In Sum: Sansa Clip is almost too small to be functional ( small screen ,buttons)", small screen ,screen
"The screen stopped working , and I was unable to do anything but push 'play', and random stuff would come up",  screen stopped working ,screen
"I'm embarrassed to say that I had a problem with not removing the screen protector, it is quite thick and completely blocks out the screen when it's on", completely blocks out the screen  ,screen
"battery was only at 50% the last time i checked, screen is blank and unresponsive", screen is blank ,screen
"My san disc worked great for five months , then stopped working entirely with the screen frozen ", screen frozen ,screen
"Display screen had odd color spots that tended to move around, and menu controls didn't work at all", screen had odd color spots ,screen
"The unit is very small, so the text on the screen is very tiny ", screen is very tiny ,screen
Stopped working with frozen screen and no clue as to how to get help, frozen screen  ,screen
"It started telling me I needed to free up space, then would promptly shut down on its own (except it didn't really shut down, it was still using battery power with a blank screen )", blank screen ,screen
The screen is too small to effectively select songs while your training,  screen is too small ,screen
My last one still works even though the screen is broken , screen is broken ,screen
The screen is small enough to see easily but doesn't take up space so the buttons are larger, screen is small ,screen
"In the middle of a song, the screen went black and the sound went dead",  screen went black ,screen
"Brand new out of the box-the menu screen doesn't work at all, the device shows as being ""critically low"" on battery power when attached to the computer, but will not charge",  screen doesn't work ,screen
"However, the resultant screen size is a serious negative when it comes to reading titles of songs or audio books, not to mention menu items", screen size is a serious negative ,screen
"In light of its ""crazy"" internal structure and the time that it takes to find folders, and a frankly too small screen , I have given this otherwise excellent player two stars", small screen ,screen
"However, after many frustrating experiences with its tiny screen and absolutely the most user-unfriendly menu of any device that I have used, I ""upgraded"" to a Sony S544 player", tiny screen  ,screen
"if you have a lot of music) Cons: Frustrating shuffle feature, difficult user interface, small buttons, small screen , playlists are difficult to make The player also does the slot radio thing",  small screen ,screen
I couldn't see the screen when outside, see the screen  ,screen
It's easy to forget that it's on because the screen will go black when not in use, screen will go black ,screen
The Sansa was a bit hard to understand the downloading of music from my PC and to understand the menu on the small screen is impossible, small screen ,screen
"The menu is as easy as you could expect, given that the small screen cannot display more than three lines at a time", screen cannot display  ,screen
"(Though be warned, the screen is hard to see in direct sunlight", screen is hard ,screen
"Within a week, I lost my music, it became unresponsive during attempts to download, the buttons stopped working consistantly, and then screen went black ", screen went black ,screen
"After a couple of years of the same treatment the Sansa recieved, the player still works, even with a cracked screen ", cracked screen ,screen
"However, after about 20 days the screen started to get weird ", screen started to get weird ,screen
"It started like something was burned into the screen, then day 40 the screen completely died , which as you can imagine makes life very difficult if you wish to do anything with it", screen completely died ,screen
"The pc can't see it when it's plugged in, the logo screen doesn't come on , it's just dead", screen doesn't come on ,screen
"I bought my daughter a ""clip"" a couple years ago, and recently her screen went dead (not uncommon)", screen went dead  ,screen
"I figured somehow I left it on and killed the battery, but when I plug it into my computer to charge it, the screen stays blank and it doesn't respond when I push the buttons", screen stays blank ,screen
After using this device for only a few hours (I only charged the battery once) it crashed on the splash screen , crashed on the splash screen ,screen
"Worked great, little screen , ability to listen to radio as well, etc", little screen ,screen
Then the power button became loose and would not even turn on when hooked onto charger, button became loose ,button
"The only other complaint is the power button and the volume button, not very ergonomic", complaint is the power button ,button
I have to click the button 10 or more times in order to get a response, have to click the button ,button
Other than the button quality it has been great, button quality ,button
The first Clip I was sent had a defective volume down button , defective volume down button ,button
I loved my little sansa clip until the volume button stopped working , button stopped working ,button
"The power button stopped working , the SanDisk people did not seem all that interested in my product return for warranty repair, put me on hold till they get around to checking out my claim", button stopped working ,button
And it's only the soft button that are no longer working ; the unit still plays, button that are no longer working ,button
"Resetting using the reset button did nothing , it is officially dead", button did nothing ,button
"This ""down"" button is very close to the bottom edge of the player, and this pronounced slope means that it is still easy to depress it",  button is very close  ,button
"- There is very little inward angle/slope on the surface of the control pad on the new Clip +, so pressing the ""down"" button is very difficult ", button is very difficult ,button
"The up, left, and right button are not affected by this as much, but the down button is nearly impossible for me to depress ", down button is nearly impossible for me to depress ,button
"Unfortunately, the on/off button creaks annoyingly because of the unit's poorer build quality", button creaks annoyingly ,button
"Worst of all, the sides and top and bottom are slanted backwards, which means that the unit is much more difficult to hold onto particularly when pressing button ", difficult to hold onto particularly when pressing button ,button
The top and bottom of the unit are not attached that strongly and the two move relative to each other when button are depressed causing annoying creaks , button are depressed causing annoying creaks ,button
It also will not turn on sometimes and a combination of the home and different button needs to be held down to coax it back to life again, button needs to be held down ,button
"The power button stopped working on one, another one the computer can't recognize when it gets plugged in, and the other two just froze, the screen froze, and the battery died and can be no longer be charged or turned on", button stopped working ,button
"After two weeks the tiny power button stopped working and the only way it would come on was to plug the player into a PC via the USB cable, so I returned it and ordered the SanDisk Sansa Clip Zip that so far works great", button stopped working  ,button
PROS: - compact - inexpensive - drag and drop of files without extra software - compatible with most audio formats - decent battery life - expandable memory CONS: - small base memory - clunky interface - tiny screen - software crashes - power button stopped working - worthless headphones, button stopped working ,button
"First ""player"" had to be returned after 10 months from purchase cause the on/off button froze in the off position", button froze ,button
"I was able to reset my Clip per instructions, but the home button does not always respond when I press it, even after resetting", button does not always respond ,button
But the tuner was very poor and the on/off button broke after one month, button broke ,button
"The button were a bit too sensitive and would occasionally get bumped, meaning I'd have to listen to a chapter over again, and the battery life monitor wasn't particularly accurate, often dying and shutting off when the battery was supposedly half full, but, otherwise it was fine", button were a bit too sensitive ,button
The first one lasted a few days before the power button broke , button broke ,button
Here are the reasons that I personally didn't like it: - The button are too small and positioned at a very bad place, button are too small ,button
"And to make that worse, the menu button does NOT bring you back to the previous screen - instead it presents a list of options - such as returning to the previous screen", button does NOT bring you back ,button
"I purchased this MP3 back in April 2010, and after seven months of general use, the up volume button broke ", button broke ,button
"Then the last straw was that after only 8 months of use, the power button stopped working ", button stopped working ,button
Then its pause button died (sigh) and the memory was full so I decided to upgrade to a 8gb, button died ,button
"The placement of the power button is such that it randomly turns itself off , which only makes the battery problem worse", button is such that it randomly turns itself off ,button
"Next, the button are very sensitive , every time I use it while doing housework or cooking it's guaranteed to touch something and press a button", button are very sensitive ,button
"Also, when I try to change a track and don't give this player my full attention, I will hit two button at the same time and lock the unit", two button at the same time ,button
"If it weren't for the power button issue , I would recommend the Sansa clip as a good cheap alternative to the ipod, but because of this known problem, I'd invest in something better", power button issue ,button
Update: I've only had it for 8 months and the power button stopped working and since it's physical damage from a few drops it isn't covered by the warranty, button stopped working ,button
So far 3 of these units have failed because the button stop working within 2 to 5 months of normal use, button stop working  ,button
On the first device the power button stopped working , button stopped working ,button
"On the second device, the volume button stopped working ", button stopped working ,button
The button become depressed and will not work anymore, button become depressed ,button
 None of the button were user friendly , None of the button were user friendly ,button
The button are miniscule and impossible to manage, button are miniscule ,button
This last week the volume button quit working ,  button quit working ,button
"Sometimes the pause button doesn't work , and sometimes it suddenly stops playing while there is no physical or electrical shock on the device", button doesn't work ,button
Than I pushed really hard and the sound button imploded , button imploded ,button
The volume button broke the first time, button broke ,button
The power button broke on my most previous one,  button broke ,button
Be warned the button are tiny so if you have larger fingers you should not get this player, button are tiny ,button
"Its power button was hard to press , and later in the week it was impossible to open/close even though USP worked", button was hard to press ,button
It's easy to bump the wrong button and lose your place,  bump the wrong button ,button
Anyway the volume+ button became difficult after a week or so, button became difficult ,button
I poked and prodded every button countless times to no avail, prodded every button ,button
prolly won't have the chance so i will get another one for sure if the button wear out, button wear ,button
"I've owned Sansa players before so I wasn't expecting much (clunky controls, easily breakable, the clip won't stay clipped to clothing), but what I wasn't expecting was for the power button to stop working in a month (so now I have to boot it by plugging it in and let it run out of charge to turn off) and randomly will stop playing until the battery wears down; the volume - (down) button stopped today", button stopped  ,button
It did freeze up occasionally - but came back after some coaxing and random pressing of the button - until the last time when it just went into coma, random pressing of the button ,button
"However, now the volume button has broken and I can't listen to the music, so it's pretty much worthless", button has broken ,button
First one I bought the on/off button stopped working , button stopped working ,button
"I'm a petite girl and find the button are difficult to push, they're so small, I usually hit a button I didn't mean to, then have to reconfigure what I was listening to", button are difficult ,button
"Its strange, a month ago the decrease volume button broke so i had music on max when using it only so that wasn't all that great and now it just broke and won't turn on", button broke ,button
The button are cheap , button are cheap ,button
then the volume control button would only work in the minus direction (internal button fell off on inspection),  button fell off  ,button
"The button aren't as responsive, the headphone jack can be sensitive for some headphones, and the volume button (which I use often) are in a less convenient and awkward position on the device", button (which I use often) are in a less convenient ,button
The 1st Sansa lasted a week and an half the off button broke and it would not shut off, button broke ,button
So returned it for my second and this is the SECOND night and the off button will not turn on and it won't recharge/turn on with the PC, button will not turn on  ,button
"I bought a used product, I knew this,but when it came the volume button was broken ,returned it with no problems", button was broken ,button
The button layout is also poor in comparison to the original clip - there is no longer the ability to 'lock button' - which is nice for going to the gym and not having to worry about bumping a button, button layout is also poor  ,button
"CLIP+ PROS: - clip+ looks nice aesthetically - ability to browse by directory CLIP+ CONS: - poor build quality - weak spring means poor grip - poor button layout - no lock button functionality - similar price to original clip, but larger capacities not offered (why not? [CLIP, looks, browse, build, means, offered] [nice, poor, weak, poor, poor, similar, original, larger] ", no lock button ,button
It no longer responded to the on-off button and connecting it to the pc did nothing, no longer responded to the on-off button ,button
The first one worked fine for a couple of months and then the button either didn't work or caused an action not meant for the button such as pressing the volume button turned the player off or restarted the player, button either didn't work ,button
Sometimes the on/off button would not work , button would not work ,button
The power button spring broke and I was unable to turn the device off and on, button spring broke  ,button
