review,span,Aspect
He couldn't explain how I could do that if the wireless router was bad , wireless router was bad ,wireless
I've had problems with the router dropping wireless connections from the get-go, dropping wireless ,wireless
"Bad News: The wireless performance is much worse with the D-Link, all other factors being the same versus the Netgear 11g WAP", wireless performance is much worse ,wireless
"It seemed that the wireless would 'crash' sporadically , and only a full system reset would bring it back up", wireless would 'crash' sporadically ,wireless
"I speculate baselessly that the very massive amounts of data I was transferring over the wired network was simply too much for the onboard processor to handle, and caused problems with the wireless ", caused problems with the wireless ,wireless
"I get better speed on the GigE ports (marginally, but it's noticeable), the wireless is more reliable , and I don't have to mess with it", wireless is more reliable ,wireless
"However, after a few weeks, it started to drop the wireless signal", started to drop the wireless ,wireless
Cold booted the router and then reconnected internet cable and re-booted all wireless connections and it worked (for another 48 hours then do it all over again), re-booted all wireless ,wireless
I was able to get an internet access for my desktop but the wireless laptop was still having problems, wireless laptop was still having ,wireless
"I noticed couple of times the wireless signal has been down but then in a few seconds, my wireless laptop reconnects", wireless signal has been down ,wireless
"While configuring the router is fairly simple, getting devices to connect to your wireless network is problematic , even when using ONLY NetGear products", wireless network is problematic ,wireless
The adapters seem to have a hard time finding the wireless network and remembering those settings for later, hard time finding the wireless ,wireless
I could not set up a secure wireless network with this router, could not set up a secure wireless ,wireless
"despite reconfiguring the modem and network setup, still no wireless internet available ", no wireless internet available ,wireless
I replace my Linksys wireless AP with an Apple Airport Extreme - much more stable, replace my Linksys wireless ,wireless
After an hour or 2 of attempting to get this to link my to my brother's weak wireless signal (100+ ft, weak wireless signal ,wireless
This thing has NO wireless capabilities , has NO wireless capabilities ,wireless
"The unit performed well for almost one year, the I started losing the wireless signal when the portable computers were moved only a few ft away", started losing the wireless ,wireless
"This unit did not even work - no wireless signal generated ! [did, work, generated] [wireless] ", no wireless signal generated ,wireless
 Have to disable and enable the wireless then it is good for two days again, Have to disable and enable the wireless ,wireless
The guest wireless feature does not work on all devices, wireless feature does not work ,wireless
"The wireless connectivity has completely died once or twice, but a quick reboot of the router got it working again", wireless connectivity has completely died ,wireless
"The wireless response seems a little slow at times when surfing the web, but it could easily be a problem with my Macintosh laptop, considering that I bought my laptop during the same week as this router and I'm still learning how to use it", wireless response seems a little slow ,wireless
It no longer broadcast a wireless signal , no longer broadcast a wireless signal ,wireless
"I can't connect to wireless , despite strong cable signal", can't connect to wireless ,wireless
After a while we noticed that the wireless would randomly drop after a few minutes, wireless would randomly drop ,wireless
"This wireless router is not for a mac , ", wireless router is not for a mac ,wireless
The wireless was very difficult to set up on the Linksys website for security, wireless was very difficult to set ,wireless
And it constantly drops wireless connections (with optimal placement and configuration where other wifi routers shine), constantly drops wireless ,wireless
So wireless failed before 2 years on both, wireless failed ,wireless
Every six days bloop no wireless , bloop no wireless ,wireless
The wireless is the problem , wireless is the problem ,wireless
This is the worst wireless product I've seen and worked with, is the worst wireless ,wireless
"I couldn't use the wireless feature throughout my house, let alone outside", couldn't use the wireless feature ,wireless
Meanwhile no wireless in my house until NetGear replaces their defective product or I suck up the loss of the purchase price of this router and buy a new one (not from these folks), no wireless in my house ,wireless
I have also run into streaming issues with wireless connects to my TV, streaming issues with wireless ,wireless
The wireless feature completely failed , wireless feature completely failed ,wireless
What really bugged me was how often I lost my wireless , lost my wireless ,wireless
"The set-up was easy and the hard-wired part of the router worked, but it didn't broadcast any wireless signal ", didn't broadcast any wireless signal ,wireless
11b adapters were not able to get the wireless link , not able to get the wireless link ,wireless
"No matter how I configured this router, I could not get the wireless network to stay up for more that a couple minutes at a time", could not get the wireless ,wireless
It worked fine for a week and then the wireless component stopped working , wireless component stopped working ,wireless
"While configuring it is very nice and easy, the router needs to be rebooted after every few hours of use or it will drop its wireless connection ", drop its wireless connection ,wireless
I had this router for 2 months and it stopped sending out the wireless signal , stopped sending out the wireless signal ,wireless
"It could just be me, but I had a hard time keeping this thing connected to my wireless router", keeping this thing connected to my wireless ,wireless
"After that, the wireless signal would drop out and not even broadcast the ssid", wireless signal would drop ,wireless
The wireless signal would not broadcast , wireless signal would not broadcast ,wireless
"after a year of usage, the wireless connections drop about once every 2 weeks", wireless connections drop ,wireless
I had a hell of time to get the wireless to work when I was talking to Linksys tech rep using my 2, had a hell of time to get the wireless to work ,wireless
" Defeating the purpose of having a wireless connection , (while leaving the other people without internet for the time I need to ftp files)", Defeating the purpose of having a wireless connection ,wireless
"Three days ago, I started to experiencing wireless drops on my MacBook where I would reset the router, only to have another drop 3 to 5 minutes later", wireless drops ,wireless
The second one I owned worked fine for about a month before the wireless capability stopped working altogether, wireless capability stopped working ,wireless
After installing this router I noticed a CONSIDERABLE slowing of both wireless and wired internet, CONSIDERABLE slowing of both wireless ,wireless
I haven't been able to use the 5 Ghz band yet since I don't have a suitable wireless adapter but the 2, don't have a suitable wireless ,wireless
"all looked good, but no wireless device was able to connect through extender to router and internet- despite seeing the extender", no wireless device was able to connect ,wireless
"I am not happy about it's near useless wireless signal,it took me two days to finish set up right", near useless wireless ,wireless
"But the wireless connection dies intermittently , sometimes as often as several times a day! [dies] [wireless, several] ", wireless connection dies intermittently ,wireless
"After 3 months of working satisfactorily, the router drops wireless and wired connections", drops wireless ,wireless
Let me first say the router is not stable in keeping the wireless connection, not stable in keeping the wireless ,wireless
Router would hang up on wireless every one or two days, hang up on wireless ,wireless
Even Netgear support rep agreed that there is a bug in the firmware which makes the router drop connection with the internet (wired and wireless), bug in the firmware ,firmware
I explained I was having problems with my WRE54G working with my WRT54G adding that I had been told by several people that I had the wrong firmware on the router, wrong firmware ,firmware
"It has a lot of problems, and there are still no firmware updates available as of mid-April", no firmware ,firmware
This model has less memory than the previous models and its firmware can NOT be easily changed to one based in linux, firmware can NOT be easily changed ,firmware
Have the same firmware problem with the V1, firmware problem ,firmware
"Even after upgrading to the latest firmware, these problems have persisted , and I suspect there are serious bugs in NATing any kind of UDP traffic (games, VoIP, etc)"," firmware, these problems have persisted ",firmware
20 firmware had been pulled and was no longer available, firmware had been pulled ,firmware
") Went online and searched, recent WRT54G firmwares had a bug with DHCP", firmwares had a bug ,firmware
I reset it rolled back firmware it would not work and stay up when I needed it, firmware it would not work ,firmware
"after 3 hours, i was told, to bring unit back and try to find a version 4 of the router, that they didnt have a 'stable' firmware yet", didnt have a 'stable' firmware ,firmware
"I should mention that the live webcams that this device refused to properly forward ports for, work perfectly with the 4500 using the identical port forwarding settings, so when I say that there is a BUG in this devices firmware regarding port forwarding, I know what I am talking about", BUG in this devices firmware ,firmware
The firmware on this router is just terrible , firmware on this router is just terrible ,firmware
"But unless you like unplugging your router twice a day to get it unstuck, avoid it until they fix the firmware ", fix the firmware ,firmware
"Again, Linksys demonstrates an amazing inability to properly test their firmware ", test their firmware ,firmware
"If that does not work, and you do not have a Linksys wga54g game adapter (or you are patient and trusting enough to wait for Linksys to correct the problem in a firmware update, or you are feeling lucky), and you have a Linksys router that the WRE54g is advertised as compatible with, purchase the WRE54g", problem in a firmware ,firmware
"This is the ""new"" version has 1/4th the memory and very buggy firmware that is NOT upgradable to customized versions", buggy firmware ,firmware
I was hoping that it might not be a hardware issue and it might be a firmware issue , firmware issue ,firmware
They had me update my VERY old firmware , old firmware ,firmware
"The first few firmware revisions were a little bumpy , but the problems I experienced were sorted out relatively quickly and the router was fast and stable - easily the best router I've owned (and there have been many)", firmware revisions were a little bumpy ,firmware
The provided firmware is useless , firmware is useless ,firmware
I was able to delete the old firmware but the new firmware would not install , firmware would not install ,firmware
The abundance of capabilities of these new boxes requires complicated firmware which quite obviously the manufacturer is not able adequately to debug, complicated firmware ,firmware
Usually Netgear firmware (yes all of the routers have the latest Netgear firmware had to offer) is really buggy and takes about a year and half to get the issues work out, firmware had to offer) is really buggy ,firmware
Now I can't use the WRE54G because of the router firmware incompatability - the extender is unstable and basically useless, firmware incompatability ,firmware
It is plagued by firmware issues since day one, firmware issues ,firmware
Tech support says to download new firmware - can't find firmware for v5 on their site, can't find firmware ,firmware
"It does not work with the original firmware that CAME with the router, it does not work with the LATEST firmware", not work with the original firmware ,firmware
"The new firmware ""bricked"" my router and I couldn't get it fixed"," firmware ""bricked"" my router ",firmware
"Its a firmware issue dealing with the searching for new clients that they haven't ironed out (and who knows if they ever will, its already been through 12 firmware revisions)similarly, the current firmware lacks the ability to set the MTU (packet size) which again while it won't interfere with your email will cause a game to crash out eventually as the packet size is nonstandard (i", firmware issue ,firmware
"Unfortunately, I ran into the same type of problems as everyone else - firmware problems , speed reduction, complete loss of internet capability from my wireless computer - you name it", firmware problems ,firmware
"Bought it in November, and slowly the signal decreased in strength, speeds dropped, gaming consoles and laptops disconnected, and finally, a firmware update destroyed it ", firmware update destroyed it ,firmware
"I'm giving 1 star for the crappy company, software, firmware buggy junk", firmware buggy ,firmware
"a few other people including me sometimes get a ""no devices attached"" situation where the firmware doesn't ""see"" the connected devices"," firmware doesn't ""see"" ",firmware
there appears to be firmware problems as well, firmware problems ,firmware
"Linksys Tech Support is pitiful, and after them telling me over 15 times to upgrade to the newest firmware, which was buggy in the first place, I gave up and swore off linksys products forever"," firmware, which was buggy ",firmware
"After many config software hangs, then firmware upgrade not completing after several tries, she suggested I take the machine back and try to get a version 2 or 3 which she said worked better! [hangs, completing, suggested, take, try, get, said, worked] [many, firmware, several] ", firmware upgrade not completing ,firmware
"If they get their firmware fixed, I would change my rating to a 4-star, but this broken firmware that doesn't allow a downgrade is four months old, so who knows how long I will have make regular trips downstairs to reboot the router", broken firmware ,firmware
Newest firmware upgrades are still unstable , firmware upgrades are still unstable ,firmware
10 version of international firmware and still have the issues , firmware and still have the issues ,firmware
This router is serviceable and has good range but the firmware corrupts the memory, firmware corrupts ,firmware
"This router has very bad firmware , and no prospects of improvement", has very bad firmware ,firmware
"The newer the firmware, the more problems it seems to have"," firmware, the more problems ",firmware
They admitted that the router has a firmware bug and then promptly closed my tech support case, firmware bug ,firmware
"D-Link KNOWS of this problem (tech support told me they know but marketing doesn't), but they still sell the router, and there is no firmware fix available", no firmware fix ,firmware
found out the version 1 model has alot of issues with the current firmware , issues with the current firmware ,firmware
I rolled back to the older firmware and still had speed issues , firmware and still had speed issues ,firmware
nowhere are firmware upgradeability issues mentioned and flagged as potential problems, firmware upgradeability issues ,firmware
"Unfortunately, the router firmware is pretty bad ", firmware is pretty bad ,firmware
"I *hate* when brand-new devices come with outdated firmware ! [come] [brand-new, outdated] ", outdated firmware ,firmware
CONS: The latest version 5 has less Flash and System RAM and uses a buggy non-Linux based firmware , buggy non-Linux based firmware ,firmware
Apparently Linksys is having firmware issues on several models (that's what the best buy guy said), firmware issues ,firmware
"The firmware is sooo shotty that they already have like 4 or 5 different versions of it out, and the worst part is that non of them work properly anyway ( I downloaded all of them )", firmware is sooo shotty ,firmware
"I upgraded the firmware, same problems "," firmware, same problems ",firmware
New firmware caused more problems than it had already, firmware caused more problems ,firmware
"It seems to be some sort of irreparable failure in the firmware , hard as that is to fathom", irreparable failure in the firmware ,firmware
This has to have bugs for sure,  has to have bugs ,firmware
"The tech support asked me to change channels ,upgrade firmware but still has the same problem ", firmware but still has the same problem ,firmware
"This router firmware is just plain bad (check out the netgear forums to see the multitude of complaints) - physically the router was fine - nice range, etc", firmware is just plain bad ,firmware
Upgraded firmware still not resolve the problem , firmware still not resolve the problem ,firmware
I called back minutes later a got another tech in the Phillipines who stayed with me on the phone for 2 hours and was extremely helpful but felt it was a firmware issue and said he would send me firmware updates via email, firmware issue ,firmware
I can't recommend this router because the firmware is just too buggy , firmware is just too buggy ,firmware
"The latest firmware does not support streaming videos! [does, support, streaming] [latest] ", firmware does not support ,firmware
3x firmware hijacked/ruined the best router, firmware hijacked/ruined ,firmware
"After explaining the problem and trying a few `standard' suggestions such as upgrading or flushing the firmware , I have been transferred to another level of support", flushing the firmware ,firmware
"As you have no doubt read in other reviews, the firmware on this model is buggy but is progressively getting better", firmware on this model is buggy ,firmware
I searched the web then i found that they have problem with the router firmware which doesnot work with most of the dsl modems available now, firmware which doesnot work ,firmware
The Netgear service tech tried and help we correct the signal issues with a firmware update and other tips, issues with a firmware update ,firmware
"it's extremely unrecommended to order these units (wrt54g version 5), very bad firmware quality inside, no options to upgrade firmware (don't expect any new version soon), no chances to get bugs fixed", very bad firmware ,firmware
They say that the latest revisions of the firmware are worse than earlier ones, firmware are worse ,firmware
"The performance is terrible, port forwarding is buggy at best, and there are definite firmware bugs ", there are  definite firmware bugs ,firmware
"Although the WCG200 ostensibly supports WDS bridging and repeating, I believe firmware incompatibilities account for my inability to obtain a secure connection between the two products", firmware incompatibilities ,firmware
 Buggy firmware update , Buggy firmware update ,firmware
According to their tech supporter the firmware can be corrupted , firmware can be corrupted ,firmware
The firmware didn't solve the problem, firmware didn't solve ,firmware
The firmware doesn't work under some scenarios, firmware doesn't work ,firmware
"The router is working, but this issue seems to indicate that the firmware wasn't thoroughly tested ", firmware wasn't thoroughly tested ,firmware
The firmware is flaky at best, firmware is flaky ,firmware
This old firmware does not contain the fixes I need, firmware does not contain ,firmware
"And nope, the new firmware hasn't fixed the issue", firmware hasn't fixed ,firmware
The router has a defective firmware that has not been fixed in multiple releases over the last year, has a defective firmware ,firmware
"The out of the box Buffalo firmware is pure garbage , but adding Tomato transforms it into an awesome router", firmware is pure garbage ,firmware
"Although I had configured the router correctly (I later discovered), the problem turned out to be defective firmware ", defective firmware ,firmware
The latest firmware didn't fix this problem, firmware didn't fix ,firmware
This firmware has to have bugs for sure, firmware has to have bugs ,firmware
This firmware has to have bugs for sure, firmware has to have bugs ,firmware
The firmware has issues . , firmware has issues ,firmware
The firmware upgrades are a pain , firmware upgrades are a pain ,firmware
Latest firmware makes things worse , firmware makes things worse ,firmware
The firmware hasn't fixed the problem, firmware hasn't fixed ,firmware
"A call to their tech support confirmed that this is a problem other users are experiencing, yet the faulty firmware is still available for download", the faulty firmware ,firmware
It stalled and a flag came up firmware failed halfway through--probably because of it's dropping the connection during file upload, firmware failed halfway ,firmware
A firmware update has not helped this issue and D-Link support has been less than helpful, firmware update has not helped ,firmware
But the router has a buggy firmware , has a buggy firmware ,firmware
Stock firmware was horrible , firmware was horrible ,firmware
The firmware updates were horrible causing more problems, firmware updates were horrible ,firmware
I went to other online sources of info and discovered that the firmware issue is rampant with a large chunk of their routers, firmware issue is rampant ,firmware
"Linksys routers, including this model have a history of having defective firmware , and it used to be necessary to replace the Linksys brand firmware with 3rd party firmware if you wanted to do any bandwidth-intensive transfer", having defective firmware ,firmware
The firmware upgrade failed , firmware upgrade failed ,firmware
The router has an unstable firmware , has an unstable firmware ,firmware
The router worked fine until Linksys shipped a buggy firmware update which prevented Macs from using the router, shipped a buggy firmware ,firmware
Updating to the newer firmware is of no use as the router won't connect, firmware is of no use ,firmware
The firmware won't connect , firmware won't connect ,firmware
"From the posts over there, sometimes updating firmware works but often doesn't ", firmware works but often doesn't ,firmware
The latest firmware is buggy related to the date/time setup and with saving changes, firmware is buggy ,firmware
Now I'm thinking I've picked up some firmware bug , firmware bug ,firmware
Version 3 of this router ships with this same crappy firmware , same crappy firmware ,firmware
"The firmware would reboot itself at least once every 1-2 days, usually when someone connected to it but not always", firmware would reboot itself ,firmware
Their automatic firmware update doesn't even acknowledge the existence of the more up-to-date versions (1, firmware update doesn't even acknowledge ,firmware
"Unfortunately for all of us, the firmware cannot be rolled back to an earlier version, so if you are one of the unlucky ones, you have no option but to buy another router, until Dlink fixes it", firmware cannot be rolled back ,firmware
"I liked Dlink, and I still do, but if you buy a new DIR-655, chances are you will get stuck with firmware ", get stuck with firmware ,firmware
but the firmware in this new model is terrible , firmware in this new model is terrible ,firmware
Netgear support did have a beta firmware patch didn't work , firmware patch didn't work ,firmware
The firmware is flaky and can cause all kinds of problems, firmware is flaky ,firmware
"I am pretty sure those problems are firmware related , not so much hardware", problems are firmware related ,firmware
I had an old Linksys wireless access point and there was no firmware support for WPA, there was no firmware support ,firmware
The latest firmware update causes even more glitches and the worst part is that the reset button on it is broken, firmware update causes even more glitches ,firmware
During a firmware upgrade it locked up and I had to return it for a new one, firmware upgrade it locked up ,firmware
"while some of the problems are related to firmware , others are related to the manual settings", problems are related to firmware ,firmware
"Found out the firmware upgrade was totally glitchy , so had to go back to a previous firmware version", firmware upgrade was totally glitchy ,firmware
The firmware update made matters worse , firmware update made matters worse ,firmware
The firmware was drastically lacking as well with many strange options missing such as being able to turn off the radios as desired, firmware was drastically lacking ,firmware
"why do you need to spend $150 for a router that will continue to have bad firmware updates ? [do, need, spend, continue, have] [bad] ", have bad firmware updates ,firmware
Every single firmware update has been a flop . , firmware update has been a flop ,firmware
The firmware is incapable of doing what is advertised, firmware is incapable ,firmware
Hardly any problems until these bad firmware updates started coming out, bad firmware updates ,firmware
This firmware is defective and I'm convinced that they know it, firmware is defective ,firmware
The provided firmware is useless , firmware is useless ,firmware
Even if it is just a firmware issue , is just a firmware issue ,firmware
"0 firmware is the culprit , but for now I would strongly caution you and would suggest you wait until D-Link figures this out and fixes these isssues", firmware is the culprit ,firmware
